[
  {
    "schema_version": "1.0.0",
    "id": "mobilidade",
    "name": "Mobilidade",
    "slug": "mobilidade",
    "description": "Transporte, deslocamento e operação metropolitana.",
    "status": "ativo"
  },
  {
    "schema_version": "1.0.0",
    "id": "infraestrutura",
    "name": "Infraestrutura",
    "slug": "infraestrutura",
    "description": "Sistemas físicos e serviços essenciais.",
    "status": "ativo"
  }
]
